"Acne Type";"Description";"Common Locations";"Common Causes";"Initial Treatment";"OTC Ingredients";"Skincare Recommendations";"Skincare Ingredients to Avoid";"When to Consult Dermatologist";"Expected Timeline";"Combination Considerations";"Skin Type Adjustments";"Age-Specific Considerations"
"Papule";"Small, red, raised bump without pus, typically inflamed";"Face (forehead, nose, chin), chest, back";"Excess sebum, dead skin cells clogging pores, bacterial infection (C. acnes), hormonal fluctuations";"Topical retinoids (tretinoin), benzoyl peroxide, topical antibiotics (clindamycin)";"Benzoyl peroxide (2.5-10%), salicylic acid (0.5-2%), sulfur";"Gentle cleansers, non-comedogenic moisturizers, oil-free sunscreen";"Heavy oils (coconut oil), alcohol-based toners, abrasive scrubs";"No improvement after 6-8 weeks, severe inflammation, scarring";"4-6 weeks with consistent treatment";"Combine with salicylic acid for blackheads, avoid over-drying";"Oily skin: light gel moisturizers, dry skin: hydrating non-comedogenic creams";"Teens: focus on oil control, adults: consider anti-aging ingredients like niacinamide"
"Pustule";"Red, inflamed bump with visible white or yellow pus-filled center";"Face (cheeks, chin), back, shoulders";"Bacterial proliferation, excess oil, inflammatory response to clogged pores";"Benzoyl peroxide, topical antibiotics (erythromycin), azelaic acid";"Benzoyl peroxide, salicylic acid, tea tree oil";"Oil-free cleansers, non-comedogenic serums, clay masks";"Comedogenic makeup, thick creams, fragranced products";"Persistent pustules, fever, or spreading redness";"2-4 weeks with proper care";"Use with non-drying retinoids to prevent irritation";"Sensitive skin: fragrance-free formulas, oily skin: mattifying products";"Adults: check for hormonal triggers, teens: avoid excessive scrubbing"
"Cyst";"Large, painful, deep pus-filled lesion under the skin, often leading to scarring";"Face, chest, back, neck";"Hormonal imbalances, genetic predisposition, severe inflammation";"Oral antibiotics (doxycycline), intralesional steroid injections, isotretinoin";"Limited OTC options (warm compresses, hydrocolloid patches)";"Anti-inflammatory ingredients (niacinamide), gentle hydrating products";"Pore-clogging agents (lanolin), harsh exfoliants";"Severe pain, recurring cysts, scarring concerns";"8-12 weeks for initial improvement";"Avoid combining with abrasive treatments, prioritize anti-inflammatory care";"Dry skin: focus on barrier repair, oily skin: use lightweight hydration";"Adults: assess hormonal health, teens: monitor for severe outbreaks"
"Nodule";"Hard, painful, deep lump beneath the skin surface without visible pus";"Jawline, cheeks, back";"Severe inflammation, hormonal fluctuations, genetic factors";"Oral isotretinoin, corticosteroids, hormonal therapy (for women)";"Limited OTC efficacy (use warm compresses)";"Soothing ingredients (centella asiatica), fragrance-free repair creams";"Irritating actives (high-strength retinols initially), alcohol";"Lesions persist beyond 6 weeks, significant discomfort";"3-6 months for full resolution";"Combine with gentle acne treatments to avoid worsening inflammation";"Sensitive skin: avoid fragrances, normal skin: incorporate mild exfoliation";"Teens: caution with isotretinoin, adults: evaluate hormonal therapies"
"Blackhead";"Open comedone with darkened oxidized sebum plug, non-inflamed";"Nose, forehead, chin (T-zone)";"Accumulated sebum and dead skin cells in open pores, oxidative stress";"Salicylic acid, retinoids (adapalene), chemical exfoliants";"Salicylic acid (0.5-2%), charcoal, clay";"Exfoliating toners, oil-free primers, clay masks";"Thick occlusive oils (mineral oil), silicone-heavy products";"Blackheads lead to inflamed acne or scarring";"4-8 weeks with consistent exfoliation";"Pair with benzoyl peroxide for inflammatory acne prevention";"Oily skin: daily exfoliation, dry skin: limit exfoliation to 2-3x/week";"Teens: emphasize consistent cleansing, adults: address pore congestion"
"Whitehead";"Closed comedone with small, flesh-colored or white bump under skin";"Forehead, chin, cheeks";"Trapped sebum and keratin in closed pores, mild inflammation";"Topical retinoids (adapalene), AHAs (glycolic acid)";"Glycolic acid (5-10%), mandelic acid, retinol (0.1-0.3%)";"Water-based moisturizers, PH-balanced cleansers";"Comedogenic sunscreens, heavy emollients";"Whiteheads progress to inflamed acne, no improvement with OTC";"3-6 weeks with regular exfoliation";"Avoid combining multiple exfoliants to prevent barrier damage";"Sensitive skin: use PHA exfoliants, oily skin: incorporate niacinamide";"Mature skin: avoid over-drying, teens: focus on prevention"